{
  "version": "1.0.0",
  "mappings": [
    {
      "mappingId": "anim-idea_received",
      "eventType": "idea_received",
      "layer": "governance_review",
      "world": "foundry",
      "requiredEvidence": ["event"],
      "actorRole": "owner",
      "source": "owner aperture",
      "destination": "Cartographer map table",
      "entity": "idea",
      "stateBefore": "no idea object",
      "transitionalState": "unformed cloud drifting toward the map table",
      "stateAfter": "idea cloud resting on the map table",
      "fullMotion": {
        "description": "An unformed luminous cloud enters from the owner aperture and settles above the Cartographer map table.",
        "durationMs": 1400,
        "cameraHint": "restrained_emphasis"
      },
      "persistentVisual": "Idea cloud with the owner-message evidence marker above the map table.",
      "reducedMotion": "Cloud appears at the table with a short fade.",
      "mobileLowPerformance": "Cloud appears; no drift path; label only.",
      "failureInterruption": "If the session ends or the event stream stops mid-motion, the module freezes at its last evidenced pose and an interrupted marker attaches; nothing completes on its own.",
      "replay": "On timeline replay the motion may be played, stepped or skipped; the persistent visual is restored exactly from the event and its evidence, never interpolated from missing events.",
      "evidenceViewDestination": "Evidence View: idea summary, owner message reference, timestamp",
      "soundHaptics": {
        "optional": true,
        "motif": "soft arrival chime"
      },
      "mustNotResemble": ["work_order_created"]
    },
    {
      "mappingId": "anim-scope_proposed",
      "eventType": "scope_proposed",
      "layer": "governance_review",
      "world": "foundry",
      "requiredEvidence": ["code_path"],
      "actorRole": "cartographer",
      "source": "Cartographer map table",
      "destination": "owner aperture",
      "entity": "acceptance contract",
      "stateBefore": "idea cloud",
      "transitionalState": "perimeter filaments drawing around the cloud",
      "stateAfter": "bounded work-order map awaiting owner acceptance",
      "fullMotion": {
        "description": "Compass drones draw boundary filaments around the cloud; acceptance landmarks light in sequence; non-goals fall beyond the horizon line; open decisions appear as unopened gates.",
        "durationMs": 2400,
        "cameraHint": "reveal_relationship"
      },
      "persistentVisual": "Bounded map with landmarks, horizon and unopened gates; no authority mark.",
      "reducedMotion": "Perimeter and landmarks appear in one fade.",
      "mobileLowPerformance": "Perimeter only; landmarks listed in the compact Evidence View.",
      "failureInterruption": "Interrupted drawing leaves a partial perimeter marked incomplete; the map cannot be handed to the Architect.",
      "replay": "On timeline replay the motion may be played, stepped or skipped; the persistent visual is restored exactly from the event and its evidence, never interpolated from missing events.",
      "evidenceViewDestination": "Evidence View: acceptance contract fields, open owner decisions",
      "soundHaptics": {
        "optional": true,
        "motif": "filament draw tone"
      },
      "mustNotResemble": ["scope_approved", "plan_completed"]
    },
    {
      "mappingId": "anim-scope_approved",
      "eventType": "scope_approved",
      "layer": "governance_review",
      "world": "foundry",
      "requiredEvidence": ["owner_decision"],
      "actorRole": "owner",
      "source": "owner aperture",
      "destination": "Cartographer map table",
      "entity": "acceptance contract",
      "stateBefore": "bounded map, unaccepted",
      "transitionalState": "owner seal descending onto the map",
      "stateAfter": "accepted map with owner seal",
      "fullMotion": {
        "description": "A golden owner seal descends onto the map perimeter; unopened gates that the decision answered open; the map becomes the work-order source.",
        "durationMs": 1200,
        "cameraHint": "restrained_emphasis"
      },
      "persistentVisual": "Owner seal glyph on the map; decision id label.",
      "reducedMotion": "Seal appears without descent.",
      "mobileLowPerformance": "Seal glyph and decision id only.",
      "failureInterruption": "A decision without a matching record cannot seal; the seal hovers with a fault glyph and the gate engine reports the missing decision.",
      "replay": "On timeline replay the motion may be played, stepped or skipped; the persistent visual is restored exactly from the event and its evidence, never interpolated from missing events.",
      "evidenceViewDestination": "Evidence View: owner decision record, applies-to",
      "soundHaptics": {
        "optional": true,
        "motif": "owner seal tone"
      },
      "mustNotResemble": ["scope_proposed", "safe_to_merge"]
    },
    {
      "mappingId": "anim-plan_completed",
      "eventType": "plan_completed",
      "layer": "governance_review",
      "world": "foundry",
      "requiredEvidence": ["code_path"],
      "actorRole": "architect",
      "source": "Architect blueprint chamber",
      "destination": "Virgil observatory",
      "entity": "implementation plan",
      "stateBefore": "accepted map",
      "transitionalState": "translucent structural layers unfolding",
      "stateAfter": "plan projection with permitted and protected volumes",
      "fullMotion": {
        "description": "The blueprint chamber unfolds translucent layers, dependency constellations, staged routes, planned scanner arrays and dark-metal protected volumes; risk distortions warp where classified.",
        "durationMs": 2600,
        "cameraHint": "reveal_relationship"
      },
      "persistentVisual": "Plan projection with protected volumes and go/no-go marker; nothing fabricated.",
      "reducedMotion": "Layers appear stacked without unfolding.",
      "mobileLowPerformance": "Two-layer projection; task graph in the compact Evidence View.",
      "failureInterruption": "A no-go verdict leaves the projection dim with the contradiction pinned; no build route opens.",
      "replay": "On timeline replay the motion may be played, stepped or skipped; the persistent visual is restored exactly from the event and its evidence, never interpolated from missing events.",
      "evidenceViewDestination": "Evidence View: plan, risk classification, reviewer formation, permitted and protected paths",
      "soundHaptics": {
        "optional": true,
        "motif": "blueprint hum"
      },
      "mustNotResemble": ["agent_started", "candidate_committed"]
    },
    {
      "mappingId": "anim-work_order_created",
      "eventType": "work_order_created",
      "layer": "governance_review",
      "world": "foundry",
      "requiredEvidence": ["event"],
      "actorRole": "virgil",
      "source": "Virgil observatory",
      "destination": "project station",
      "entity": "work order",
      "stateBefore": "plan projection",
      "transitionalState": "scope condensing into a bounded object",
      "stateAfter": "work-order object docked at the station",
      "fullMotion": {
        "description": "The approved scope condenses into a faceted work-order object listing promise, criteria, non-goals, permitted and protected surfaces, required evidence, stop conditions and open decisions.",
        "durationMs": 1600,
        "cameraHint": "none"
      },
      "persistentVisual": "Work-order object at the project station with its field list inspectable.",
      "reducedMotion": "Object appears docked.",
      "mobileLowPerformance": "Object appears; fields in the compact Evidence View.",
      "failureInterruption": "If any required field is absent the object fails to close and shows the missing field; no assignment can attach.",
      "replay": "On timeline replay the motion may be played, stepped or skipped; the persistent visual is restored exactly from the event and its evidence, never interpolated from missing events.",
      "evidenceViewDestination": "Evidence View: work order fields",
      "soundHaptics": {
        "optional": true,
        "motif": "condense tone"
      },
      "mustNotResemble": ["authority_granted", "idea_received"]
    },
    {
      "mappingId": "anim-authority_granted",
      "eventType": "authority_granted",
      "layer": "governance_review",
      "world": "foundry",
      "requiredEvidence": ["owner_decision", "event"],
      "actorRole": "virgil",
      "source": "Virgil observatory",
      "destination": "role station",
      "entity": "authority token",
      "stateBefore": "no token",
      "transitionalState": "token travelling on its own lane, separate from the work order",
      "stateAfter": "token docked at the role station showing tier, actions, boundary, expiry, stop conditions",
      "fullMotion": {
        "description": "An authority token travels from the observatory on a separate lane from any artifact; on docking it displays tier, permitted actions, boundary, expiry and stop conditions.",
        "durationMs": 1500,
        "cameraHint": "none"
      },
      "persistentVisual": "Docked token with legible tier and expiry; boundary volume outlined at the station.",
      "reducedMotion": "Token appears docked with its fields.",
      "mobileLowPerformance": "Token icon with tier; fields in the compact Evidence View.",
      "failureInterruption": "A grant without the decision its tier requires cannot dock; it hovers with a fault glyph.",
      "replay": "On timeline replay the motion may be played, stepped or skipped; the persistent visual is restored exactly from the event and its evidence, never interpolated from missing events.",
      "evidenceViewDestination": "Evidence View: grant record, decision, boundary",
      "soundHaptics": {
        "optional": true,
        "motif": "key-turn tone"
      },